{
  "schemaVersion": 1,
  "candidateVersion": "legacy-portable-content-candidate-v1",
  "source": {
    "repository": "Xpotato1024/xpotato-site",
    "tag": "legacy-pre-vnext-2026-08-28",
    "tagObjectSha": "8503f5a50a5fb3d27a02422da0b50dc66c818b02",
    "commitSha": "927d105713561309fc5e2374396f86646b5aeb2a",
    "inventoryPayloadSha256": "9151be197d9e48a12297d45dfdd2a72a15cf9ce16f143fdc16b60e5345d37493"
  },
  "mappingPayloadSha256": "f1f1bb4d49ffb838720cfbe417fcec34988dba1aec7c72c30daa4cd2fc30b3a9",
  "candidates": [
    {
      "candidateVersion": "legacy-portable-content-candidate-v1",
      "legacyContentId": "blog:2025-10-06",
      "vNextContentId": "f202daa7-cb5c-4dd3-8b17-7bb6b1feefae",
      "legacyPath": "src/content/blog/2025-10-06.mdx",
      "targetPath": "apps/site/src/content/blog/2025-10-06.mdx",
      "collection": "blog",
      "title": "ConoHa VPSのSSH公開鍵認証設定手順",
      "description": "この記事では、ConoHa VPSにSSHで安全に接続するために必要な「公開鍵認証」の設定手順を、初心者にも分かりやすく解説します。 ConoHa VPSでは、第三者による不正アクセスを防ぐため、パスワード認証よりも安全な 公開鍵認証方式 でのSSH接続が推奨されています。この方式では、手元のPC（ローカルマ",
      "draft": false,
      "stableEditorialFields": {
        "title": "ConoHa VPSのSSH公開鍵認証設定手順",
        "description": "この記事では、ConoHa VPSにSSHで安全に接続するために必要な「公開鍵認証」の設定手順を、初心者にも分かりやすく解説します。 ConoHa VPSでは、第三者による不正アクセスを防ぐため、パスワード認証よりも安全な 公開鍵認証方式 でのSSH接続が推奨されています。この方式では、手元のPC（ローカルマ",
        "pubDate": "2025-10-06",
        "updatedDate": "2025-10-09",
        "draft": false,
        "legacyPath": "/?p=811"
      },
      "deferredTaxonomy": {
        "category": [
          "network"
        ],
        "tags": [
          "conoha-vps",
          "programing",
          "ssh",
          "vps",
          "webサーバー",
          "公開鍵認証",
          "初心者向け"
        ]
      },
      "deferredMediaLocators": [
        "/wp-content/uploads/2025/10/19EBD197-78A0-4E6A-82A4-7365DF22AF13.png"
      ],
      "deferredInteractiveComponents": [],
      "legacyHtmlStatus": "static_manual_review",
      "body": {
        "sourceBodySha256": "a656fc6c518e9919b14d70e040f8f1be5928016a41a1292d5dce9f427e3931db",
        "status": "manual_review",
        "validationErrors": [
          "React/filesystem implementation path",
          "arbitrary runtime import/export",
          "unapproved JSX/HTML element: LegacyHtml"
        ]
      },
      "blockers": [
        "legacy_html_review",
        "media_mapping",
        "taxonomy_mapping"
      ],
      "candidatePayloadSha256": "82fe51759010a16b04d4f5ad4243bb134400cd2337c37c819d6c3f917461e8fb"
    },
    {
      "candidateVersion": "legacy-portable-content-candidate-v1",
      "legacyContentId": "blog:anythingllm-fresh-thread-reembed-workspace",
      "vNextContentId": "4ccd039f-2625-4f2b-83bb-fe248906ef96",
      "legacyPath": "src/content/blog/anythingllm-fresh-thread-reembed-workspace.mdx",
      "targetPath": "apps/site/src/content/blog/anythingllm-fresh-thread-reembed-workspace.mdx",
      "collection": "blog",
      "title": "AnythingLLMでdefaultスレッドだけ正しいときに確認すべきこと",
      "description": "AnythingLLM + Qdrant + vLLM の RAG で、default スレッドは答えるのに新規スレッドだけ外れるときの見方、再埋め込み、Qdrant 再構築の順番をまとめます。",
      "draft": false,
      "stableEditorialFields": {
        "title": "AnythingLLMでdefaultスレッドだけ正しいときに確認すべきこと",
        "description": "AnythingLLM + Qdrant + vLLM の RAG で、default スレッドは答えるのに新規スレッドだけ外れるときの見方、再埋め込み、Qdrant 再構築の順番をまとめます。",
        "pubDate": "2026-03-21"
      },
      "deferredTaxonomy": {
        "category": [],
        "tags": [
          "AnythingLLM",
          "RAG",
          "Qdrant",
          "vLLM"
        ]
      },
      "deferredMediaLocators": [
        "/blog-placeholder-1.jpg"
      ],
      "deferredInteractiveComponents": [],
      "legacyHtmlStatus": "none",
      "body": {
        "sourceBodySha256": "329ca928c2e6ed5f09a0b8a6593126f625e1a60064a9f73b9dc34661f6b8b487",
        "status": "portable_as_is",
        "candidateBodySha256": "329ca928c2e6ed5f09a0b8a6593126f625e1a60064a9f73b9dc34661f6b8b487",
        "validationErrors": []
      },
      "blockers": [
        "media_mapping",
        "taxonomy_mapping"
      ],
      "candidatePayloadSha256": "161045d864b5fea765fd4125edc853dc00f4e11c97c5bdd525049b3b9551391a"
    },
    {
      "candidateVersion": "legacy-portable-content-candidate-v1",
      "legacyContentId": "blog:anythingllm-vllm-followup-streaming-workaround",
      "vNextContentId": "debd5571-6924-42db-a4a6-4e9a748cf0e6",
      "legacyPath": "src/content/blog/anythingllm-vllm-followup-streaming-workaround.mdx",
      "targetPath": "apps/site/src/content/blog/anythingllm-vllm-followup-streaming-workaround.mdx",
      "collection": "blog",
      "title": "AnythingLLM + vLLM で follow-up chat が落ちる時の切り分けと暫定対処",
      "description": "Qwen3.5-4B-AWQ + vLLM + AnythingLLM + TEI + Qdrant 構成で、最初のRAG応答は通るのに follow-up chat だけ Internal Server Error になる問題を、non-streaming 運用で暫定回避した記録です。",
      "draft": false,
      "stableEditorialFields": {
        "title": "AnythingLLM + vLLM で follow-up chat が落ちる時の切り分けと暫定対処",
        "description": "Qwen3.5-4B-AWQ + vLLM + AnythingLLM + TEI + Qdrant 構成で、最初のRAG応答は通るのに follow-up chat だけ Internal Server Error になる問題を、non-streaming 運用で暫定回避した記録です。",
        "pubDate": "2026-03-20",
        "updatedDate": "2026-03-20",
        "draft": false
      },
      "deferredTaxonomy": {
        "category": [
          "infra"
        ],
        "tags": [
          "rag",
          "anythingllm",
          "vllm",
          "qwen",
          "wsl",
          "troubleshooting"
        ]
      },
      "deferredMediaLocators": [],
      "deferredInteractiveComponents": [],
      "legacyHtmlStatus": "none",
      "body": {
        "sourceBodySha256": "c44f05482308d80a81b9b4e6fe842ed1f0b69267a513bb78202d43cd6be03257",
        "status": "portable_as_is",
        "candidateBodySha256": "c44f05482308d80a81b9b4e6fe842ed1f0b69267a513bb78202d43cd6be03257",
        "validationErrors": []
      },
      "blockers": [
        "taxonomy_mapping"
      ],
      "candidatePayloadSha256": "ca456adb32523f7a1370d33934dc7bc54124c7be17bd9b2de69498ede0a9cd39"
    },
    {
      "candidateVersion": "legacy-portable-content-candidate-v1",
      "legacyContentId": "blog:codex-sqlite-write-amplification-mitigation",
      "vNextContentId": "d422c494-da2b-4826-b3c3-5f154e67ac09",
      "legacyPath": "src/content/blog/codex-sqlite-write-amplification-mitigation.mdx",
      "targetPath": "apps/site/src/content/blog/codex-sqlite-write-amplification-mitigation.mdx",
      "collection": "blog",
      "title": "Codex の SQLite ログ書き込みを調査して SSD write amplification を封じ込めた記録",
      "description": "Codex Desktop / CLI の logs_2.sqlite への高頻度書き込みを Windows 上で ETW と SQLite metadata から追跡し、TRACE/DEBUG の永続化抑制と自動 Guard まで構築した記録。",
      "draft": false,
      "stableEditorialFields": {
        "title": "Codex の SQLite ログ書き込みを調査して SSD write amplification を封じ込めた記録",
        "description": "Codex Desktop / CLI の logs_2.sqlite への高頻度書き込みを Windows 上で ETW と SQLite metadata から追跡し、TRACE/DEBUG の永続化抑制と自動 Guard まで構築した記録。",
        "pubDate": "2026-07-27",
        "updatedDate": "2026-07-27",
        "draft": false
      },
      "deferredTaxonomy": {
        "category": [
          "devlog"
        ],
        "tags": [
          "codex",
          "windows",
          "sqlite",
          "ssd",
          "performance",
          "debugging"
        ]
      },
      "deferredMediaLocators": [],
      "deferredInteractiveComponents": [],
      "legacyHtmlStatus": "none",
      "body": {
        "sourceBodySha256": "372eb3a7bd690b99e02b76521a2dbf6d58b547f3916a91354f325456a496db1b",
        "status": "portable_as_is",
        "candidateBodySha256": "372eb3a7bd690b99e02b76521a2dbf6d58b547f3916a91354f325456a496db1b",
        "validationErrors": []
      },
      "blockers": [
        "taxonomy_mapping"
      ],
      "candidatePayloadSha256": "62ad30fb3c50119eaa59221a05ea02fa2a89eb8ec917e5dcb06aaf901036179f"
    },
    {
      "candidateVersion": "legacy-portable-content-candidate-v1",
      "legacyContentId": "blog:compacting-wsl-vhd-in-place-after-c-drive-move",
      "vNextContentId": "3d9d467f-c8a6-4c52-8bfb-ae47135bcd79",
      "legacyPath": "src/content/blog/compacting-wsl-vhd-in-place-after-c-drive-move.mdx",
      "targetPath": "apps/site/src/content/blog/compacting-wsl-vhd-in-place-after-c-drive-move.mdx",
      "collection": "blog",
      "title": "WSL VHD を 273GB から 81GB まで縮小した記録",
      "description": "C ドライブへ移した Ubuntu-24.04 の ext4.vhdx を in-place で縮小した。なぜ肥大化したのか、失敗した順番、成功した手順、運用上の注意点をまとめる。",
      "draft": false,
      "stableEditorialFields": {
        "title": "WSL VHD を 273GB から 81GB まで縮小した記録",
        "description": "C ドライブへ移した Ubuntu-24.04 の ext4.vhdx を in-place で縮小した。なぜ肥大化したのか、失敗した順番、成功した手順、運用上の注意点をまとめる。",
        "pubDate": "2026-03-21",
        "updatedDate": "2026-03-21",
        "draft": false
      },
      "deferredTaxonomy": {
        "category": [
          "infra"
        ],
        "tags": [
          "wsl",
          "windows",
          "homelab",
          "storage",
          "troubleshooting"
        ]
      },
      "deferredMediaLocators": [],
      "deferredInteractiveComponents": [],
      "legacyHtmlStatus": "none",
      "body": {
        "sourceBodySha256": "7f87ea610b415c0972e66b6d00c1bab85fce3262fd0da9b8dcf126834d7fee8f",
        "status": "portable_as_is",
        "candidateBodySha256": "7f87ea610b415c0972e66b6d00c1bab85fce3262fd0da9b8dcf126834d7fee8f",
        "validationErrors": []
      },
      "blockers": [
        "taxonomy_mapping"
      ],
      "candidatePayloadSha256": "da2312eca5b06aedad6c3b303d82ee4606437636f90a58175f67e7b7ac1fb386"
    },
    {
      "candidateVersion": "legacy-portable-content-candidate-v1",
      "legacyContentId": "blog:gale-adaptive-conservative-planner",
      "vNextContentId": "4b33bb9d-e1ef-4b7a-9f8b-2b5e51a60289",
      "legacyPath": "src/content/blog/gale-adaptive-conservative-planner.mdx",